    1 0.000000000 192.168.1.110 → 192.168.1.109 TCP 74 59540 → 8000 [SYN] Seq=0 Win=29200 Len=0 MSS=1460 SACK_PERM=1 TSval=19351030 TSecr=0 WS=128
    2 0.000024809 192.168.1.109 → 192.168.1.110 TCP 74 8000 → 59540 [SYN, ACK] Seq=0 Ack=1 Win=28960 Len=0 MSS=1460 SACK_PERM=1 TSval=65040625 TSecr=19351030 WS=128
    3 0.200679605 192.168.1.110 → 192.168.1.109 TCP 66 59540 → 8000 [ACK] Seq=1 Ack=1 Win=29312 Len=0 TSval=19351080 TSecr=65040625
    4 0.200749528 192.168.1.109 → 192.168.1.110 TCP 1090 8000 → 59540 [PSH, ACK] Seq=1 Ack=1 Win=29056 Len=1024 TSval=65040675 TSecr=19351080
    5 0.200842621 192.168.1.110 → 192.168.1.109 TCP 66 59540 → 8000 [ACK] Seq=1 Ack=1025 Win=31360 Len=0 TSval=19351080 TSecr=65040675
    6 0.200889192 192.168.1.110 → 192.168.1.109 TCP 1090 59540 → 8000 [PSH, ACK] Seq=1 Ack=1025 Win=31360 Len=1024 TSval=19351080 TSecr=65040675
    7 0.200911977 192.168.1.109 → 192.168.1.110 TCP 66 8000 → 59540 [ACK] Seq=1025 Ack=1025 Win=31104 Len=0 TSval=65040675 TSecr=19351080
    8 0.200936390 192.168.1.109 → 192.168.1.110 TCP 1090 8000 → 59540 [PSH, ACK] Seq=1025 Ack=1025 Win=31104 Len=1024 TSval=65040675 TSecr=19351080
    9 0.201006775 192.168.1.110 → 192.168.1.109 TCP 1090 59540 → 8000 [PSH, ACK] Seq=1025 Ack=2049 Win=33408 Len=1024 TSval=19351080 TSecr=65040675
   10 0.201052053 192.168.1.109 → 192.168.1.110 TCP 1090 8000 → 59540 [PSH, ACK] Seq=2049 Ack=2049 Win=33152 Len=1024 TSval=65040675 TSecr=19351080
   11 0.201130653 192.168.1.110 → 192.168.1.109 TCP 1090 59540 → 8000 [PSH, ACK] Seq=2049 Ack=3073 Win=35456 Len=1024 TSval=19351080 TSecr=65040675
   12 0.201163835 192.168.1.109 → 192.168.1.110 TCP 1090 8000 → 59540 [PSH, ACK] Seq=3073 Ack=3073 Win=35200 Len=1024 TSval=65040675 TSecr=19351080
   13 0.201254587 192.168.1.110 → 192.168.1.109 TCP 1090 59540 → 8000 [PSH, ACK] Seq=3073 Ack=4097 Win=37504 Len=1024 TSval=19351080 TSecr=65040675
   14 0.201277028 192.168.1.109 → 192.168.1.110 TCP 1090 8000 → 59540 [PSH, ACK] Seq=4097 Ack=4097 Win=37248 Len=1024 TSval=65040675 TSecr=19351080
   15 0.201348390 192.168.1.110 → 192.168.1.109 TCP 1090 59540 → 8000 [PSH, ACK] Seq=4097 Ack=5121 Win=39552 Len=1024 TSval=19351080 TSecr=65040675
   16 0.201377233 192.168.1.109 → 192.168.1.110 TCP 1090 8000 → 59540 [PSH, ACK] Seq=5121 Ack=5121 Win=39296 Len=1024 TSval=65040675 TSecr=19351080
   17 0.201507530 192.168.1.110 → 192.168.1.109 TCP 1090 59540 → 8000 [PSH, ACK] Seq=5121 Ack=6145 Win=41600 Len=1024 TSval=19351080 TSecr=65040675
   18 0.201549058 192.168.1.109 → 192.168.1.110 TCP 1090 8000 → 59540 [PSH, ACK] Seq=6145 Ack=6145 Win=41344 Len=1024 TSval=65040675 TSecr=19351080
   19 0.201627479 192.168.1.110 → 192.168.1.109 TCP 1090 59540 → 8000 [PSH, ACK] Seq=6145 Ack=7169 Win=43648 Len=1024 TSval=19351080 TSecr=65040675
   20 0.201670543 192.168.1.109 → 192.168.1.110 TCP 1090 8000 → 59540 [PSH, ACK] Seq=7169 Ack=7169 Win=43392 Len=1024 TSval=65040675 TSecr=19351080
   21 0.201745224 192.168.1.110 → 192.168.1.109 TCP 1090 59540 → 8000 [PSH, ACK] Seq=7169 Ack=8193 Win=45696 Len=1024 TSval=19351080 TSecr=65040675
   22 0.201780617 192.168.1.109 → 192.168.1.110 TCP 1090 8000 → 59540 [PSH, ACK] Seq=8193 Ack=8193 Win=45440 Len=1024 TSval=65040675 TSecr=19351080
   23 0.201854879 192.168.1.110 → 192.168.1.109 TCP 1090 59540 → 8000 [PSH, ACK] Seq=8193 Ack=9217 Win=47744 Len=1024 TSval=19351080 TSecr=65040675
   24 0.201888700 192.168.1.109 → 192.168.1.110 TCP 1090 8000 → 59540 [PSH, ACK] Seq=9217 Ack=9217 Win=47488 Len=1024 TSval=65040675 TSecr=19351080
   25 0.201958282 192.168.1.110 → 192.168.1.109 TCP 1090 59540 → 8000 [PSH, ACK] Seq=9217 Ack=10241 Win=49792 Len=1024 TSval=19351080 TSecr=65040675
   26 0.202220656 192.168.1.109 → 192.168.1.110 TCP 66 8000 → 59540 [FIN, ACK] Seq=10241 Ack=10241 Win=49536 Len=0 TSval=65040675 TSecr=19351080
   27 0.202341545 192.168.1.110 → 192.168.1.109 TCP 66 59540 → 8000 [FIN, ACK] Seq=10241 Ack=10242 Win=49792 Len=0 TSval=19351080 TSecr=65040675
   28 0.202366767 192.168.1.109 → 192.168.1.110 TCP 66 8000 → 59540 [ACK] Seq=10242 Ack=10242 Win=49536 Len=0 TSval=65040675 TSecr=19351080
   29 9.631643422 192.168.1.110 → 192.168.1.109 TCP 74 59541 → 8000 [SYN] Seq=0 Win=29200 Len=0 MSS=1460 SACK_PERM=1 TSval=19353438 TSecr=0 WS=128
   30 9.631683457 192.168.1.109 → 192.168.1.110 TCP 74 8000 → 59541 [SYN, ACK] Seq=0 Ack=1 Win=28960 Len=0 MSS=1460 SACK_PERM=1 TSval=65043033 TSecr=19353438 WS=128
   31 9.832678213 192.168.1.110 → 192.168.1.109 TCP 66 59541 → 8000 [ACK] Seq=1 Ack=1 Win=29312 Len=0 TSval=19353488 TSecr=65043033
   32 9.832760033 192.168.1.109 → 192.168.1.110 TCP 1090 8000 → 59541 [PSH, ACK] Seq=1 Ack=1 Win=29056 Len=1024 TSval=65043083 TSecr=19353488
   33 9.832860786 192.168.1.110 → 192.168.1.109 TCP 66 59541 → 8000 [ACK] Seq=1 Ack=1025 Win=31360 Len=0 TSval=19353488 TSecr=65043083
   34 9.832912003 192.168.1.110 → 192.168.1.109 TCP 1090 59541 → 8000 [PSH, ACK] Seq=1 Ack=1025 Win=31360 Len=1024 TSval=19353488 TSecr=65043083
   35 9.832920892 192.168.1.109 → 192.168.1.110 TCP 66 8000 → 59541 [ACK] Seq=1025 Ack=1025 Win=31104 Len=0 TSval=65043083 TSecr=19353488
   36 9.832955620 192.168.1.109 → 192.168.1.110 TCP 1090 8000 → 59541 [PSH, ACK] Seq=1025 Ack=1025 Win=31104 Len=1024 TSval=65043083 TSecr=19353488
   37 9.833035521 192.168.1.110 → 192.168.1.109 TCP 1090 59541 → 8000 [PSH, ACK] Seq=1025 Ack=2049 Win=33408 Len=1024 TSval=19353488 TSecr=65043083
   38 9.833122611 192.168.1.109 → 192.168.1.110 TCP 1090 8000 → 59541 [PSH, ACK] Seq=2049 Ack=2049 Win=33152 Len=1024 TSval=65043083 TSecr=19353488
   39 9.833224690 192.168.1.110 → 192.168.1.109 TCP 1090 59541 → 8000 [PSH, ACK] Seq=2049 Ack=3073 Win=35456 Len=1024 TSval=19353488 TSecr=65043083
   40 9.833272997 192.168.1.109 → 192.168.1.110 TCP 1090 8000 → 59541 [PSH, ACK] Seq=3073 Ack=3073 Win=35200 Len=1024 TSval=65043083 TSecr=19353488
   41 9.833393062 192.168.1.110 → 192.168.1.109 TCP 1090 59541 → 8000 [PSH, ACK] Seq=3073 Ack=4097 Win=37504 Len=1024 TSval=19353488 TSecr=65043083
   42 9.833460020 192.168.1.109 → 192.168.1.110 TCP 1090 8000 → 59541 [PSH, ACK] Seq=4097 Ack=4097 Win=37248 Len=1024 TSval=65043083 TSecr=19353488
   43 9.833536219 192.168.1.110 → 192.168.1.109 TCP 1090 59541 → 8000 [PSH, ACK] Seq=4097 Ack=5121 Win=39552 Len=1024 TSval=19353488 TSecr=65043083
   44 9.833575620 192.168.1.109 → 192.168.1.110 TCP 1090 8000 → 59541 [PSH, ACK] Seq=5121 Ack=5121 Win=39296 Len=1024 TSval=65043083 TSecr=19353488
   45 9.833662204 192.168.1.110 → 192.168.1.109 TCP 1090 59541 → 8000 [PSH, ACK] Seq=5121 Ack=6145 Win=41600 Len=1024 TSval=19353488 TSecr=65043083
   46 9.833705904 192.168.1.109 → 192.168.1.110 TCP 1090 8000 → 59541 [PSH, ACK] Seq=6145 Ack=6145 Win=41344 Len=1024 TSval=65043083 TSecr=19353488
   47 9.833793868 192.168.1.110 → 192.168.1.109 TCP 1090 59541 → 8000 [PSH, ACK] Seq=6145 Ack=7169 Win=43648 Len=1024 TSval=19353488 TSecr=65043083
   48 9.833835201 192.168.1.109 → 192.168.1.110 TCP 1090 8000 → 59541 [PSH, ACK] Seq=7169 Ack=7169 Win=43392 Len=1024 TSval=65043083 TSecr=19353488
   49 9.833929678 192.168.1.110 → 192.168.1.109 TCP 1090 59541 → 8000 [PSH, ACK] Seq=7169 Ack=8193 Win=45696 Len=1024 TSval=19353488 TSecr=65043083
   50 9.833998566 192.168.1.109 → 192.168.1.110 TCP 1090 8000 → 59541 [PSH, ACK] Seq=8193 Ack=8193 Win=45440 Len=1024 TSval=65043083 TSecr=19353488
   51 9.834115068 192.168.1.110 → 192.168.1.109 TCP 1090 59541 → 8000 [PSH, ACK] Seq=8193 Ack=9217 Win=47744 Len=1024 TSval=19353488 TSecr=65043083
   52 9.834149635 192.168.1.109 → 192.168.1.110 TCP 1090 8000 → 59541 [PSH, ACK] Seq=9217 Ack=9217 Win=47488 Len=1024 TSval=65043083 TSecr=19353488
   53 9.834291586 192.168.1.110 → 192.168.1.109 TCP 1090 59541 → 8000 [PSH, ACK] Seq=9217 Ack=10241 Win=49792 Len=1024 TSval=19353488 TSecr=65043083
   54 9.834568919 192.168.1.109 → 192.168.1.110 TCP 66 8000 → 59541 [FIN, ACK] Seq=10241 Ack=10241 Win=49536 Len=0 TSval=65043084 TSecr=19353488
   55 9.834711223 192.168.1.110 → 192.168.1.109 TCP 66 59541 → 8000 [FIN, ACK] Seq=10241 Ack=10242 Win=49792 Len=0 TSval=19353488 TSecr=65043084
   56 9.834721706 192.168.1.109 → 192.168.1.110 TCP 66 8000 → 59541 [ACK] Seq=10242 Ack=10242 Win=49536 Len=0 TSval=65043084 TSecr=19353488
   57 17.967653620 192.168.1.110 → 192.168.1.109 TCP 74 59542 → 8000 [SYN] Seq=0 Win=29200 Len=0 MSS=1460 SACK_PERM=1 TSval=19355522 TSecr=0 WS=128
   58 17.967681304 192.168.1.109 → 192.168.1.110 TCP 74 8000 → 59542 [SYN, ACK] Seq=0 Ack=1 Win=28960 Len=0 MSS=1460 SACK_PERM=1 TSval=65045117 TSecr=19355522 WS=128
   59 18.168662651 192.168.1.110 → 192.168.1.109 TCP 66 59542 → 8000 [ACK] Seq=1 Ack=1 Win=29312 Len=0 TSval=19355572 TSecr=65045117
   60 18.168740921 192.168.1.109 → 192.168.1.110 TCP 1090 8000 → 59542 [PSH, ACK] Seq=1 Ack=1 Win=29056 Len=1024 TSval=65045167 TSecr=19355572
   61 18.168842082 192.168.1.110 → 192.168.1.109 TCP 66 59542 → 8000 [ACK] Seq=1 Ack=1025 Win=31360 Len=0 TSval=19355572 TSecr=65045167
   62 18.168934283 192.168.1.110 → 192.168.1.109 TCP 1090 59542 → 8000 [PSH, ACK] Seq=1 Ack=1025 Win=31360 Len=1024 TSval=19355572 TSecr=65045167
   63 18.168957123 192.168.1.109 → 192.168.1.110 TCP 66 8000 → 59542 [ACK] Seq=1025 Ack=1025 Win=31104 Len=0 TSval=65045167 TSecr=19355572
   64 18.169027960 192.168.1.109 → 192.168.1.110 TCP 1090 8000 → 59542 [PSH, ACK] Seq=1025 Ack=1025 Win=31104 Len=1024 TSval=65045167 TSecr=19355572
   65 18.169191454 192.168.1.110 → 192.168.1.109 TCP 1090 59542 → 8000 [PSH, ACK] Seq=1025 Ack=2049 Win=33408 Len=1024 TSval=19355572 TSecr=65045167
   66 18.169265591 192.168.1.109 → 192.168.1.110 TCP 1090 8000 → 59542 [PSH, ACK] Seq=2049 Ack=2049 Win=33152 Len=1024 TSval=65045167 TSecr=19355572
   67 18.169433871 192.168.1.110 → 192.168.1.109 TCP 1090 59542 → 8000 [PSH, ACK] Seq=2049 Ack=3073 Win=35456 Len=1024 TSval=19355572 TSecr=65045167
   68 18.169495850 192.168.1.109 → 192.168.1.110 TCP 1090 8000 → 59542 [PSH, ACK] Seq=3073 Ack=3073 Win=35200 Len=1024 TSval=65045167 TSecr=19355572
   69 18.169667931 192.168.1.110 → 192.168.1.109 TCP 1090 59542 → 8000 [PSH, ACK] Seq=3073 Ack=4097 Win=37504 Len=1024 TSval=19355572 TSecr=65045167
   70 18.169715881 192.168.1.109 → 192.168.1.110 TCP 1090 8000 → 59542 [PSH, ACK] Seq=4097 Ack=4097 Win=37248 Len=1024 TSval=65045167 TSecr=19355572
   71 18.169919219 192.168.1.110 → 192.168.1.109 TCP 1090 59542 → 8000 [PSH, ACK] Seq=4097 Ack=5121 Win=39552 Len=1024 TSval=19355572 TSecr=65045167
   72 18.169970628 192.168.1.109 → 192.168.1.110 TCP 1090 8000 → 59542 [PSH, ACK] Seq=5121 Ack=5121 Win=39296 Len=1024 TSval=65045167 TSecr=19355572
   73 18.170118366 192.168.1.110 → 192.168.1.109 TCP 1090 59542 → 8000 [PSH, ACK] Seq=5121 Ack=6145 Win=41600 Len=1024 TSval=19355572 TSecr=65045167
   74 18.170181120 192.168.1.109 → 192.168.1.110 TCP 1090 8000 → 59542 [PSH, ACK] Seq=6145 Ack=6145 Win=41344 Len=1024 TSval=65045167 TSecr=19355572
   75 18.170326910 192.168.1.110 → 192.168.1.109 TCP 1090 59542 → 8000 [PSH, ACK] Seq=6145 Ack=7169 Win=43648 Len=1024 TSval=19355572 TSecr=65045167
   76 18.170374934 192.168.1.109 → 192.168.1.110 TCP 1090 8000 → 59542 [PSH, ACK] Seq=7169 Ack=7169 Win=43392 Len=1024 TSval=65045167 TSecr=19355572
   77 18.170538225 192.168.1.110 → 192.168.1.109 TCP 1090 59542 → 8000 [PSH, ACK] Seq=7169 Ack=8193 Win=45696 Len=1024 TSval=19355572 TSecr=65045167
   78 18.170596769 192.168.1.109 → 192.168.1.110 TCP 1090 8000 → 59542 [PSH, ACK] Seq=8193 Ack=8193 Win=45440 Len=1024 TSval=65045168 TSecr=19355572
   79 18.170765527 192.168.1.110 → 192.168.1.109 TCP 1090 59542 → 8000 [PSH, ACK] Seq=8193 Ack=9217 Win=47744 Len=1024 TSval=19355572 TSecr=65045168
   80 18.170819759 192.168.1.109 → 192.168.1.110 TCP 1090 8000 → 59542 [PSH, ACK] Seq=9217 Ack=9217 Win=47488 Len=1024 TSval=65045168 TSecr=19355572
   81 18.171002515 192.168.1.110 → 192.168.1.109 TCP 1090 59542 → 8000 [PSH, ACK] Seq=9217 Ack=10241 Win=49792 Len=1024 TSval=19355572 TSecr=65045168
   82 18.171223080 192.168.1.109 → 192.168.1.110 TCP 66 8000 → 59542 [FIN, ACK] Seq=10241 Ack=10241 Win=49536 Len=0 TSval=65045168 TSecr=19355572
   83 18.171322077 192.168.1.110 → 192.168.1.109 TCP 66 59542 → 8000 [FIN, ACK] Seq=10241 Ack=10242 Win=49792 Len=0 TSval=19355572 TSecr=65045168
   84 18.171329307 192.168.1.109 → 192.168.1.110 TCP 66 8000 → 59542 [ACK] Seq=10242 Ack=10242 Win=49536 Len=0 TSval=65045168 TSecr=19355572
   85 27.271555549 192.168.1.110 → 192.168.1.109 TCP 74 59543 → 8000 [SYN] Seq=0 Win=29200 Len=0 MSS=1460 SACK_PERM=1 TSval=19357848 TSecr=0 WS=128
   86 27.271575428 192.168.1.109 → 192.168.1.110 TCP 74 8000 → 59543 [SYN, ACK] Seq=0 Ack=1 Win=28960 Len=0 MSS=1460 SACK_PERM=1 TSval=65047443 TSecr=19357848 WS=128
   87 27.472667729 192.168.1.110 → 192.168.1.109 TCP 66 59543 → 8000 [ACK] Seq=1 Ack=1 Win=29312 Len=0 TSval=19357898 TSecr=65047443
   88 27.472824520 192.168.1.109 → 192.168.1.110 TCP 1090 8000 → 59543 [PSH, ACK] Seq=1 Ack=1 Win=29056 Len=1024 TSval=65047493 TSecr=19357898
   89 27.472956548 192.168.1.110 → 192.168.1.109 TCP 66 59543 → 8000 [ACK] Seq=1 Ack=1025 Win=31360 Len=0 TSval=19357898 TSecr=65047493
   90 27.473307303 192.168.1.110 → 192.168.1.109 TCP 1090 59543 → 8000 [PSH, ACK] Seq=1 Ack=1025 Win=31360 Len=1024 TSval=19357898 TSecr=65047493
   91 27.473320728 192.168.1.109 → 192.168.1.110 TCP 66 8000 → 59543 [ACK] Seq=1025 Ack=1025 Win=31104 Len=0 TSval=65047493 TSecr=19357898
   92 27.473575265 192.168.1.109 → 192.168.1.110 TCP 1090 8000 → 59543 [PSH, ACK] Seq=1025 Ack=1025 Win=31104 Len=1024 TSval=65047493 TSecr=19357898
   93 27.473940862 192.168.1.110 → 192.168.1.109 TCP 1090 59543 → 8000 [PSH, ACK] Seq=1025 Ack=2049 Win=33408 Len=1024 TSval=19357898 TSecr=65047493
   94 27.474089397 192.168.1.109 → 192.168.1.110 TCP 1090 8000 → 59543 [PSH, ACK] Seq=2049 Ack=2049 Win=33152 Len=1024 TSval=65047493 TSecr=19357898
   95 27.474475827 192.168.1.110 → 192.168.1.109 TCP 1090 59543 → 8000 [PSH, ACK] Seq=2049 Ack=3073 Win=35456 Len=1024 TSval=19357898 TSecr=65047493
   96 27.474688528 192.168.1.109 → 192.168.1.110 TCP 1090 8000 → 59543 [PSH, ACK] Seq=3073 Ack=3073 Win=35200 Len=1024 TSval=65047494 TSecr=19357898
   97 27.475067279 192.168.1.110 → 192.168.1.109 TCP 1090 59543 → 8000 [PSH, ACK] Seq=3073 Ack=4097 Win=37504 Len=1024 TSval=19357898 TSecr=65047494
   98 27.475218834 192.168.1.109 → 192.168.1.110 TCP 1090 8000 → 59543 [PSH, ACK] Seq=4097 Ack=4097 Win=37248 Len=1024 TSval=65047494 TSecr=19357898
   99 27.475668543 192.168.1.110 → 192.168.1.109 TCP 1090 59543 → 8000 [PSH, ACK] Seq=4097 Ack=5121 Win=39552 Len=1024 TSval=19357899 TSecr=65047494
  100 27.475885525 192.168.1.109 → 192.168.1.110 TCP 1090 8000 → 59543 [PSH, ACK] Seq=5121 Ack=5121 Win=39296 Len=1024 TSval=65047494 TSecr=19357899
  101 27.476246587 192.168.1.110 → 192.168.1.109 TCP 1090 59543 → 8000 [PSH, ACK] Seq=5121 Ack=6145 Win=41600 Len=1024 TSval=19357899 TSecr=65047494
  102 27.476452818 192.168.1.109 → 192.168.1.110 TCP 1090 8000 → 59543 [PSH, ACK] Seq=6145 Ack=6145 Win=41344 Len=1024 TSval=65047494 TSecr=19357899
  103 27.476802649 192.168.1.110 → 192.168.1.109 TCP 1090 59543 → 8000 [PSH, ACK] Seq=6145 Ack=7169 Win=43648 Len=1024 TSval=19357899 TSecr=65047494
  104 27.476991591 192.168.1.109 → 192.168.1.110 TCP 1090 8000 → 59543 [PSH, ACK] Seq=7169 Ack=7169 Win=43392 Len=1024 TSval=65047494 TSecr=19357899
  105 27.477345990 192.168.1.110 → 192.168.1.109 TCP 1090 59543 → 8000 [PSH, ACK] Seq=7169 Ack=8193 Win=45696 Len=1024 TSval=19357899 TSecr=65047494
  106 27.477488331 192.168.1.109 → 192.168.1.110 TCP 1090 8000 → 59543 [PSH, ACK] Seq=8193 Ack=8193 Win=45440 Len=1024 TSval=65047494 TSecr=19357899
  107 27.477869785 192.168.1.110 → 192.168.1.109 TCP 1090 59543 → 8000 [PSH, ACK] Seq=8193 Ack=9217 Win=47744 Len=1024 TSval=19357899 TSecr=65047494
  108 27.478093589 192.168.1.109 → 192.168.1.110 TCP 1090 8000 → 59543 [PSH, ACK] Seq=9217 Ack=9217 Win=47488 Len=1024 TSval=65047494 TSecr=19357899
  109 27.478442565 192.168.1.110 → 192.168.1.109 TCP 1090 59543 → 8000 [PSH, ACK] Seq=9217 Ack=10241 Win=49792 Len=1024 TSval=19357899 TSecr=65047494
  110 27.478623976 192.168.1.109 → 192.168.1.110 TCP 66 8000 → 59543 [FIN, ACK] Seq=10241 Ack=10241 Win=49536 Len=0 TSval=65047495 TSecr=19357899
  111 27.478753955 192.168.1.110 → 192.168.1.109 TCP 66 59543 → 8000 [FIN, ACK] Seq=10241 Ack=10242 Win=49792 Len=0 TSval=19357899 TSecr=65047495
  112 27.478759238 192.168.1.109 → 192.168.1.110 TCP 66 8000 → 59543 [ACK] Seq=10242 Ack=10242 Win=49536 Len=0 TSval=65047495 TSecr=19357899
